;Оригинал;Перевод на казахский;Перевод на русский
412;ыреудын шыгарып тастаган диванын лактырды деп кояды.. Ищвините, подъездге шыгарып койса, ол жерде кайдагы балкон чтобы выкинуть??? Подьездегы терезеге симайдыго. Просто отмазка сол адамдыкы, типа шыгарып койган и всё.;Біреудің шығарып тастаған диванын лақтырды деп қояды. Кешіріңіз, кіреберіске шығарып қойса, ол жерде қайдагы қылтима, тастау үшін? Кіреберістегі терезеге сыймайды ғой. Тек сылтау сол адамдікі,  шығарып қойган есеп, болды.;Сказали, что выкинули диван, который кто-то вынес на помойку. Но извините, если бы вынесли в подъезд, какой там балкон, с которого выкинули?. Он же не помещается в окно подъезда. Это просто отмазка того человека, типа вынес во двор.
413;Ерінбей отырып әр квартираның тұрғындарының фотоларын тексеріп шықса да табуға болады ғой;Ерінбей отырып әр пәтердің тұрғындарының фотоларын тексеріп шықса да табуға болады ғой;Если не полениться, то можно проверить фотографии всех жителей подъезда и найти виновного.
414;Диванды кім лақтырғаны белгісіз?! Мынау енді ақылға сыймайды. Как будто ручка лақтырғандай болды ғой;Диванды кім лақтырғаны белгісіз?! Мынау енді ақылға сыймайды. Жай қалам лақтырғандай болды ғой.;Неизвестно, кто выкинул диван? Это в мозгу не укладываетсяя. Как будто выинули ручку.
415;Днк сараптамасы аркылы издесе табуга болатын еди, чето бас катыргылары келмегенгой дим баринин.;ДНҚ сараптамасы арқылы іздесе табуға болатын еді, біртүрлі бас қатырғылары келмеген ғой деймін бәрінен.;Можно же найти по анализу ДНК, че-то кажется не хочет никто париться.
416;Коршилер негізі біледі гой подъезде кім не шыгарғанын просто бир бирин прикрывать етип отыр.;Көршілер негізі біледі ғой кіреберісте кім не шығарғанын, тек бір-бірін жауып отыр.;Соседи же, в принципе, знают, кто что вынес. Они просто прирывают друг друга.
417;Малсындар ма калай табылмайды. Любой заттын ушу траекториясы болады бунын тыке тобеден кудаганы белгылы. 2 шы кабаттан ен сонгы кабатка дейынгы адамдарды тергесе болды гой;Малсыңдар ма қалай табылмайды. Кез келген заттың ұшу траекториясы болады, бұның тіке төбеден құлағаны белгілі. 2-ші қабаттан ең соңғы қабатқа дейінгі адамдарды тергесе болды ғой.;Вы что скоты, почему не можете найти? У любого летщего предмета есть траектория полета, понятно, что мебель упала сверху. Почему не проверят людей, живущих со 2 до последнего этажа? 
418;Бір көреиік 1июньда бітіріп деп еді балаларымызбен қоса өзімізде зорға жеттік 1июньға . Енді дұрыс болды деп ойлаймын;Бір көреиік 1 маусымды бітіріп деп еді балаларымызбен қоса өзіміз де зорға жеттік 1 маусымға. Енді дұрыс болды деп ойлаймын.;Заставили учиться до 1 июня, мы сами вместе с детьми еле выдержали. Теперь правильно сделали, думаю.
419;немене бардак салып жур мыналар;Немене тәртіпсіздікке салынып жур мыналар?;Почему они устраивают бардак?
420;Соз жок буларга кун ауыстыруман пенсия жасын ауыстыруды гана жаксы биледи;Сөз жоқ бұларға, күн ауыстыруман зейнет жасын ауыстыруды ғана жақсы біледі.;Слов нет для них. Они только и умеют, что менять сроки и возраст пенсии.
421;ССР кезіннен бері келе жатқан 25 майғой неғыласындар өзгертіп 1 июньға әрең жетіңдерғой балалардың мыйын ашытып 25 майда соңғы қоңырау болғаны жақсы ғой Орнында тұрғаны мақұл 25 май;КСРО кезіннен бері келе жатқан 25 мамыр ғой, не қыласындар өзгертіп 1 маусымға әрең жетіңдер ғой, балалардың мыйын ашытып, 25 мамырда соңғы қоңырау болғаны жақсы ғой. Орнында тұрғаны мақұл 25 май.;Со времен СССР идет дата 25 мая. Зачем менять на 1 июня. Еле дожили до 1 июня, дети устали, лучше чтобы последни звонок ыл 25 мая. Пусть остается как есть, 25 мая.
422;Неужели [Имя] көпке бармайтынын түсінбеді. Бастаған ісін аяқтау керек еді немесе;[Есімі] көпке бармайтынын түсінбеді ме қалай. Бастаған ісін аяқтау керек еді немесе.;Неужели [Имя] не понимает, что это долго не продолжится. Надо было закончить начатое дело или.
423;Ол тірі. Просто ойыннан шығарып жіберді!;Ол тірі. Тек оны  ойыннан шығарып жіберді!;Он жив. Просто его удалили из игры.
424;Біздін пограничниктерді солаи құртқан ,басында көтерсен болды ;Біздін шекарашыларды солай құртқан, басында көтерсең болды. ;Вот так и уничтожили наших пограничников, стоило начать.
425;Залогка коятын уйлери бар бай адамдарга берилетин несие деп сразу айту кереккой;Кепілдікке қоятын үйлері бар бай адамдарға берілетін несие деп бірден айту керек кой.;Сразу надо было сказать, что это кредит для богатых людей, у которых есть  дом для залога.
426;Бір кредиттен шыға алмай, бір кредитке бату дейсің ғой ;Бір несиеден шыға алмай, бір несиеге бату дейсің ғой. ;Не успел выйти из одного кредита, ак сразу влезаешь в другой кредит.
427;"Коментаторлар которые пишут ""емшекті жабу керек"" деп вы больные. Сонда ашык турса барып ұстау керекпа? Өздеріңнің әйелдерің, қарындастарыңның кеуделеріне осылай қолдарын тықсын бір мал. Көрем сонда сайрағандарыңды.";"""Емшекті жабу керек"" деп жазып жатқан адамдар, сендер аурусыңдар. Сонда ашық тұрса барып ұстау керек пе? Өздеріңнің әйелдерің, қарындастарыңның кеуделеріне осылай қолдарын тықсын бір мал. Көрем сонда сайрағандарыңды.";"Комментаторы, которые пишут, что ""надо прикрывать грудь"" вы больные. Значит, если грудь открыта, ее надо трогать? Неужели любой скотина может залезть руками в груди ваших жен, сестер."
428;Киімі тұр жап жақсы прилично киінген! Сендер дұрыстап үйреніңдер көргенсіздер!;Киімі тұр жап-жақсы, дұрыс адам ұқсап киінген! Сендер дұрыстап үйреніңдер көргенсіздер!;Одежда хорошая, прилично выглядят. Хорошо учитесь, бессовестные.
429;Явно мына малдың әйелі бала шағасы бар го ;Мына малдың әйелі бала шағасы бар ғой, айдан анық.;У этого скотины явно есть жена, дети.
430;шык или жабык,вульгарно или нет-это уже другой вопрос и отвечать за это женщине самой и точно не перед человеком;Ашық немесе жабық, тұрпайы ма, тұрпайы емес пе - бұл басқа сұрақ. Оған әйелдің өзі жауап береді және адамның алдында емесі анық.;Открыто или закрыто, вульгарно или нет - это друго вопрос и отвечать за это женщине само и точно не перед человеком.
431;шанс пайдаланып калгангоц;Мүмкіндікті  пайдаланып калган ғой.;Воспользовался возможностью.
432;Бұл жігіттің ісі дұрыс емес әрине. Және әуретін ашып жүрген әйелдікіде дұрыс емес. Екеуінеде штраф салыңыздар.;Бұл жігіттің ісі дұрыс емес әрине. Және әуретін ашып жүрген әйелдікі де дұрыс емес. Екеуіне де айыппұл салыңыздар.;У этого парня, конечно, не все впорядке с головой. Но и женщина с открытой грудбю тоже неправа. На обоих надо наложить штраф.
433;Түуу,ойланып жүр едім,кім төлейді екен деп,жауабын наконец-то таптым ау;Тууу, ойланып жүр едім, кім төлейді екен деп ,жауабын әйтеуір таптым-ау.;Ох, я переживала, кто заплатит, наконец-то нашла ответ.
434;Логично ғой ата анасы төлеуі керек екендігі;Дұрыс қой, ата-анасы төлеуі керек екендігі.;Логично же, что родители будут платить.
435;Бұны любой дурак біледі ғой.;Бұны ақымақ адам да біледі ғой.;Это же любой дурак знает.
436;Конечно толеймиз;Әрине, төлейміз.;Конечно, заплатим.
437;Оның несін айтып отырсың әй шырағым. Білеміз итакта. Қанды ішкірлер, жөнді бірдеңе шығарыңшиш;Оның несін айтып отырсың-әй, шырағым. Білеміз онсызда. Қанды ішкірлер, жөнді бірдеңе шығарыңшейші.;Зачем это говоришь, дорогой, и без тебя знаем. Кровопийцы, лучше придумали бы что-нибудь полезное.
438;Кызымнын колы уксуска тиип кетип шынтагы жерге урылып сынган. Тазалап, акшасын толеп, кеширим сурадым. Уксустын ииси жаман алып кетти ишин. Бари сыртка шыкты. Уялганым жок полын жуып бердим.;Қызымның қолы сірке суына тиіп кетіп, шынтағы жерге ұрылып сынған. Тазалап, ақшасын төлеп, кешірім сұрадым. Сірке суының иісі жаман алып кетті ішін. Бәрі сыртқа шықты. Ұялғаным жоқ еденін жуып бердім.;На руку моей дочери попал уксус и она локтем ударилась об пол. Я убрала все, заплатила, попросила прощение. Запах уксуса был сильным. Все вышли на улицу. Мне не было стыдно,  им вымыла пол.
439;Мяяя ды ты что кушти жаналык аштыгой;Маа солай ма, күшти жаналық ашты ғой.;Маа, да ты что, это же хорошая новость.
440;Машина вообще сатылмай жатыр. ;Көлік мүлдем сатылмай жатыр. ;Машина вообще никак не продается.
441;немецкий машиналарынды сатпандар ондай машина енды таппайсындар;Неміс көліктеріңді сатпаңдар, ондай көлік енді таппайсыңдар.;Не продавайте немецкие машины, таких вы больше не найдете.
442;Запчастьттарын тоже акелыныздер; Қосалқы бөлшектерін де әкеліңіздер.;Запчасти тоже привозите.
443;2 жылда шығып келеді за хороший поведение;2 жылда шығып келеді жақсы тәртіп үшін.;Через 2 года выйдет за хорошее поведение.
444;Шомылуга болмайтын жерлерге ограждение жасап коюга болмайма екен;Шомылуға болмайтын жерлерге қоршау жасап қоюга болмай  ма екен.;Почему нельзя поставить ограждение где нельзя плавать.
445;Шахтерларды пенсияга ерте шыгарукерек,жумыстары отте каупты Жердин астынды ауасыз ,светзиз Енбектерин багалап ,зейнеттке ерте шыгарсын;Шахтерлерді зейнетке ерте шығару керек, жұмыстары өте қауіпті. Жердің астында ауасыз, жарықсыз, еңбектерін бағалап, зейнеттке ерте шығарсын.;Шахтеров надо пораньше отпускать на пенсию, их работа очень опасная. Под землей, без воздуха, без света. Надо ценить их труд и отпускать пораньше на пенсию.
446;Смотря канша акша толит и кому это выгодно;Қанша ақша төлейді және бұл кімге пайдалы екеніне қарай.;Смотря сколько уудут платить и кому это выгодно.
447;скенде по любому өшін алады;Өскенде бәрібір өшін алады.;Когда вырастет, по-любому будет мстить.
448;Ой прям катырар. Сиыр сипаганша деп, заңнан кашып айтып отыргандары да.;Ойпырмай, қатырар. Сиыр сипағанша деп, заңнан қашып айтып отырғандары да.;Ой впрямь, сделают они. Когда рак на горе свистнет, лишь бы уйти от закона.
449;Коррупция жайлаған елде АЭС салу қауіпті сияқты…;Жемқорлық жайлаған елде АЭС салу қауіпті сияқты.;Где повсеместна коррупция, опасно строить АЭС.
450;Ресей или Қытай го как обычно;Ресей немесе Қытай гой әдеттегідей.;Россия или Китай, как обычно.
451;Явно Қытай саладығо.Не үшін ашып қойды айипесе...Орыстар салмайды...;Қытай салатыны анық ғой. Не үшін ашып қойды айтпесе. Орыстар салмайды.;Явно, Кита будет строить. Иначе почему открыли его. Русские не будут строить.
452;Енди түсиникти болды маңғыстаудағы заводтың неге сынып калғаны!;Енді түсінікті болды, Маңғыстаудағы зауоттың неге сынып калғаны!;Теперь ясно стало, почему сломался завод в Мангистау.
453;Мусорға тастаитын ұшақтар едіғо тот басқан;Қоқысқа тастайтын ұшақтар еді ғой, тот басқан;Это ыли самолеты, которые давно надо было выкинть на мусорку, ржавчина съела их.
454;Әскерилер маскүнем бір-біріне звания медаль тағып соны қырлы стаканға салып арақ ішеді;Әскерилер маскүнем бір-біріне шен, медаль тағып, соны қырлы шыныға салып арақ ішеді.;Военные алкаши, дат друг-другу звания, медали, кладут их в граненые стаканы и пьют водку.
455;Өте үлкен штраф салып, елден депортация ету керек, әйтпегенде бұлар құтыра береді. Елге кіргізбей қою керек, басқалары ойлансын;Өте үлкен айыппұл салып, елден қуу  керек, әйтпегенде бұлар құтыра береді. Елге кіргізбей қою керек, басқалары ойлансын.;Надо наложить очень большой штраф и выдворить их из страны, иначе они и дальше будут борзеть. Их нельзя пускать в страну, пусть другие подумают.
456;Аямай штраф төлетіп ,қамау керек;Аямай айыппұл төлетіп, қамау керек.;Его следует оштрафовать и посадить в тюрьму.
457;Неге жарияға жар саласыңыздар продукт қымбаттайдығо;Неге жарияға жар саласыңыздар азық-түлік қымбаттайды ғой.;Почему вы это сообщаете всему миру, теперь цена на продукты вырастут.
458;Бир тиын косады айлыкка соны жариялап, мадактайды, каскан айлыгымыз кымбаттап дайын турады гой товармен, тамакпен;Бір тиын қосады айлыққа соны жариялап, мадақтайды, қосқан айлығымыз қымбаттап дайын тұрады ғой тауармен, тамақпен.;Добавят копейку к зарплате и важно сообщают об этом, хвалятся этим. Но вместе с зарпатой растут и цены на товар и продукты.
459;Неге көтермелеу Жаңа Қазақстанбыз дейміз ақшасын көбейсе продукты өседі өсірмеу керек;Неге көтермелеу, Жаңа Қазақстанбыз дейміз ақшасын көбейсе азық-түлік өседі, өсірмеу керек.;Зачем увеличивать? Говорим, что Новый Казахстан. Если поднть зарплаты, поднимутся и цены на продукты.
460;Право қымбаттайды деп айтсай бір сөзбен;Жүргізуші куәлігі қымбаттайды деп айтсай бір сөзбен.;Одним словом, водительские права станут дороже.
461;Акша болса права соз емес;Акша болса жүргізуші куәлігі сөз емес.;Если есть деньги, водительские права не проблема.
462;40 мынга курс алып, +5 тыс какие-то документы и 2 аптада права алдым, ешкімге акша бермей, жыламай. Елдер неге сатып алуға құмар 🤦, көлік айдайтын адам праваны бәрі бір үйренуі кереккой!;40 мыңға курс алып, +5 мың қайдағы жоқ құжаттар және 2 аптада жүргізуші куәлігін алдым, ешкімге ақша бермей, жыламай. Елдер неге сатып алуға құмар, көлік айдайтын адам көлік айдауды бәрі бір үйренуі керек кой!;Прошла курс за 40000, и плюс 5000 за какие-то непонятные документы и за 2 недели получила водительские права. Никому не давая деньги, не ноя. Почем люди стремятся все решить деньгами, человек, который будет водить машину, все равнодолжен же научиться водить.
463;Праваны қиындатқаны соншалық, бір улкен обылысқа бір көлік!!! Ол бузылса катастрофа болады ау…;Жүргізуші куәлігін қиындатқаны соншалық, бір үлкен обылысқа бір көлік!!! Ол бұзылса үлкен дау болады-ау.;Так сложно стало получить водительские права, на одну большую область одна машина. Если она сломаетс, будет большой конфликт.
464;Тамақ 1-4 сыныпқа дейін и так тегін ғой, немене одан жаңалық істеп?;Тамақ 1-4 сыныпқа дейін онсызда тегін ғой, немене одан жаңалық істеп?;Питание для 1-4 классов и так бесплатное, почему из этого делаете новость?
465;Қазір кім еріккеннен поо жуғысы келеді, жағдайы төмен болған соң істейді сол жұмысты, сол пол жуышы болып мектепке кіретін болсан 100 мың, 200 мың ақша сұрайды жемқорлар арсыздар;Қазір кім еріккеннен еден жуғысы келеді, жағдайы төмен болған соң істейді сол жұмысты, сол еден жуышы болып мектепке кіретін болсан 100 мың, 200 мың ақша сұрайды жемқорлар, арсыздар.;Кто сейчас добровольно хочет мыть полы, из-за низкого положения делают эту работу. Чтобы устроиться уборщицей школу, нужно заплатить 100-200 тысяч тенге. Бессовестные коррупционеры.
